{
  "blog": {
    "c4p": {
      "backgroundColor": "#3647a5",
      "brief": "GDG DevFest Ukraine was announced, for the sixth year in a row, the conference will bring together 900 developers, managers and...",
      "content": "GDG DevFest Ukraine was announced, for the sixth year in a row, the conference will bring together 900 developers, managers and entrepreneurs on **October 13-14** to Lviv.  This year our team is doing big advancement in the content, we're building an extra stage to accommodate more visitors and provide three fully independent tracks on Android, Web and Google Cloud topics.  Our focus is the content. **We’re looking for speakers like you**, who are ready to rock the stage and deliver the best talk or workshop in the field.  \"I've been to conferences all over the world and what you've created in Lviv is world class. It's easily first league of conferences.\" - Piotr Tuszynski, DevFest '16 Keynote Speaker  <div layout horizontal center-justified> <a href=\"http://bit.ly/df17-c4p\" rel=\"noopener noreferrer\">   <md-filled-button>Submit a proposal</md-filled-button> </a> </div>  ## Why is it cool to speak at the DevFest?  DevFest Ukraine is not an ordinary tech conference, besides selecting only the best speakers, we help them to succeed in delivering an exceptional quality talk on the stage.  Here are few perks that all our speakers get:  - **Expences covered**. Hotel for 3 nights, travel costs and entrance to exclusive speaker parties are covered for all speakers. - **Professional video recording**. We work with experienced video production companies to create session recording of the best quality. Stage, screen, audio, all is recorded separately and combined later. Check the [session videos from the last year](https://www.youtube.com/watch?v=VOwUnBkqmo4). - **Exposure**. By being a speaker, you are proving your level of expertise to a potential business partners or employers. Your talk will be promoted in our online resources and recording published in YouTube channel with more than 35k views. - **Unique networking**. Being a speaker means you’ll have the unique chance to network with other speakers - the best experts in the industry. - **Coaching**. We're in the same boat, after being selected as a speaker our program committee will help you to deliver the best talk possible. We provide information about the audience, presentation templates, feedback on the slides, all to help you to prepare.  \"It was a best DevFest I ever attended. So professional, so much enthusiasm from the community. You managed to bring the vibe of Google I/O to Ukraine.\" - David Vávra, DevFest '16 Speaker  ## What are we looking for?  We're looking for **experience-based talks**, the information that can not be found in the documentation or easily googled. We're looking for your stories, your struggles, research results and experiences with the frontier tools or technologies. Check the [list of topics](https://docs.google.com/document/d/18eGvBr6wdlXsfiZM4EK6SubfL3G1RWj-ABTBN9pngNg/edit?usp=sharing) we're interested in (it is not full and updated all the time).  ### Format  You can submit as many talks as you want. This year we accept submissions in two formats:   - 40 minutes sessions.   - 2(or 3) hours workshops.  ### Talks that will not pass initial review  - Talks about a specific tool/library/project explaining how it works or how to use it.  - Talks whose focus is pitching a company or project. It’s cool that you mention your company during the presentation, but it shouldn’t be the focus of the talk.  - Proposals that are not in English.  - Recruitment talks to attract talent.  We strongly recommend you check out [speaking.io](http://speaking.io/) website from Zach Holman. It includes good tips and guidelines for speakers.   ## Timeline  **Call for Papers submission deadline is July 1, 2017.** Submission results will be announced by July 16.   Any questions? Email organizers at [devfest@gdg.org.ua](mailto:devfest@gdg.org.ua)  <div layout horizontal center-justified> <a href=\"http://bit.ly/df17-c4p\" rel=\"noopener noreferrer\">   <md-filled-button primary>Submit a proposal</md-filled-button> </a> </div>",
      "image": "/images/posts/c4p.jpg",
      "published": "2017-02-12",
      "source": "/data/posts/2017-02-12-c4p.md",
      "title": "We're looking for speakers"
    },
    "dfua-summary": {
      "backgroundColor": "#ffc107",
      "brief": "GDG DevFest Ukraine 2016",
      "content": " [****DevFest Ukraine****](https://devfest.gdg.org.ua/) - it was fun, advantageous, crowded and exciting event! The scale of DevFest is simply breathtaking - 2 days full of Android, Web and Cloud hardcore!   The 5th annual conference GDG DevFest Ukraine - the biggest one related to Google techlogies in CEE - was held on September 9-10, 2016 in Lviv, Ukraine. The conference was powered by [Google Developers Group Lviv](http://lviv.gdg.org.ua/) (GDG Lviv) in together with the Google Developer Groups from all over Ukraine.   Some terrific facts about DevFest: ----------------------------------  - almost **700 attendees** - great open-minded people, full of  passion and great ideas  - incredibly high concentration of [Google Developer Experts](https://developers.google.com/experts/) in one place - **12** top-notch professionals  - **33 speakers** - well experienced, armed with knowledges and obsessed with Google technologies from all over the world  (UK, Israel, Germany, USA, Poland, Ukraine, Czech Republic, Switzerland, Romania, Turkey, Russia)  - **14** participating **GDG Groups**’ representatives (GDG Krakow, GDG Cherkasy, GDG Basel, GDG Prague, GDG Dnipro, GDG Kyiv-Center, GDG Istanbul, GDG Lviv, GDG Odessa, GDG Ternopil, GDG Uzhhorod, GDG KPI, GDG Kremenchuk, GDG Khmelnytskyi)  - **16** participating countries (UK, Israel, Germany, USA, Poland, Ukraine, Czech Republic, Switzerland, Romania, Turkey, Russia, The Netherlands, Belarus, Finland, Kazakhstan, Côte d’Ivoire)  - lots of sessions were full of deep knowledge and inspiration. Only technical stuff, only hardcore! Android sessions as always overcrowded.  <img loading=\"lazy\" src=\"/images/posts/summary16_2.jpg\"  />  - Progressive Web Apps (PWA) theme was the most popular on Web track, moreover, people could try it in practice on 2 workshops, hold by [Martin Splitt](http://localhost:4040/speakers/41/) and [Jakub Škvára](http://localhost:4040/speakers/18/).  <img loading=\"lazy\" src=\"/images/posts/summary16_3.jpg\"  />  - amazing demo zones were around (AR-music, DIY cardboards, Tilt Brush....)  <img loading=\"lazy\" src=\"/images/posts/summary16_4.jpg\"  />  - especially Emotobooth  <img loading=\"lazy\" src=\"/images/posts/summary16_5.jpg\"  />  - a big number of epic selfies :)  <img loading=\"lazy\" src=\"/images/posts/summary16_6.jpg\"  />  - the silent party was definitely something new for everyone! People rocked the floor like they never do before!  <img loading=\"lazy\" src=\"/images/posts/summary16_8.jpg\"  />   The conference became possible through the support of a number of companies. **Big THANK** to all of DevFest’s sponsors, namely: - *General partner* - [Google](https://www.google.com.ua/intl/en/about/) - *Diamond partner* - [intouch](http://www.intouchmena.com/) - *Platinum partners* - [CoreValue](http://www.corevalue.com.ua/), [GlobalLogic](http://www.globallogic.com/), [Wolters Kluwer](http://wolterskluwer.com/), [N-iX](http://n-ix.com/), [Mirantis](https://www.mirantis.com/), [DataArt](http://dataart.ua/), [Zalando](https://tech.zalando.de/), [FM Standart](http://fm-standard.com/en), [Design Proof](http://designprof.com.ua/) - Gold partners -  [Ciklum](https://www.ciklum.com/), [Sigma](http://sigma.software/), [Rucus](https://www.ruckuswireless.com/).  And, of course, a BIG THANK to all the volunteers from different GDG groups of Ukraine for their priceless help.  <img loading=\"lazy\" src=\"/images/posts/summary16_7.jpg\"  />  We hope you found the conference informative and worthwhile. The primary goal of DevFest  was to bring together all of you - professionals and passionate geeks of our industry - from around the world to exchange experience, share valuable knowledges and to contribute in possible strategies as to how Ukraine can become recognized and more engaged in initiatives taking place in developing IT industry and education first of all.  Your presence helped to make this event a great success, and your enthusiasm and positive spirit helped to make our time together both productive and fun.  We wish you all the best and hope that you continue to be engaged with the DevFest Ukraine. BTW, stay tuned for upcoming events by visiting [lviv.gdg.org.ua](http://lviv.gdg.org.ua/) and subscribing to our news, like us on [Facebook](https://facebook.com/GDGLviv) and follow on [Twitter](https://twitter.com/intent/user?screen_name=GDGLviv)!  Post-Conference Follow-Up ------------------------- As a reminder, we are working on transcribing the plenary sessions' slides (in ~1 week) and HD video records (in ~1-2 months), and once everything has been aggregated, we’ll notify you.  Please visit our Facebook [page](https://www.facebook.com/GDGLviv/) to view the photos, or the DevFest [website](https://devfest.gdg.org.ua/) in one week.  See you at the next events!   With love,  GDG DevFest Ukraine Team",
      "image": "/images/posts/summary16_1.jpg",
      "published": "2016-09-10",
      "title": "DevFest Ukraine rocked - SUMMARY"
    },
    "dfua17-announced": {
      "backgroundColor": "#2196F3",
      "brief": "It is official. GDG DevFest Ukraine 2017 is going to take place in Lviv, on October 13-14.",